{
  "version": "v10",
  "base": [
    "v9",
    "v8.1"
  ],
  "generated": "2025-10-25T23:34:04.494Z",
  "summary": {
    "sharpe": -1.1031,
    "mdd": -0.2033,
    "robustness": 83.2,
    "balance": "NEGATIVO"
  },
  "insight": {
    "insight": "Desviaci贸n cognitiva leve detectada.",
    "explanation": "La memoria simbi贸tica detecta un rendimiento negativo sostenido con una robustez estable. Indica posible sobreajuste en estrategias recientes.",
    "advice": "Ejecuta un nuevo ciclo de optimizaci贸n Monte Carlo y reduce la sensibilidad de los hiperpar谩metros.",
    "tone": "NEGATIVO"
  },
  "meta": {
    "source": "OMEGA Cognitive Core",
    "compatibleWithTutor": true
  },
  "tutor": " Versi贸n del Tutor: v10.1 (Symbiont Advisor)\n--------------------------------------------\n Sharpe: -1.1031\n MDD: -0.2033\n Robustez: 83.20%\n Balance general: NEGATIVO\n Insight: Desviaci贸n cognitiva leve detectada.\n\nЗ Explicaci贸n:\nLa memoria simbi贸tica detecta un rendimiento negativo sostenido con una robustez estable. Indica posible sobreajuste en estrategias recientes.\n\n Sugerencia:\nEjecuta un nuevo ciclo de optimizaci贸n Monte Carlo y reduce la sensibilidad de los hiperpar谩metros.\n\n--------------------------------------------\n Generado por OMEGA Learn v10.1 (Capa de Tutor铆a Cognitiva Adaptativa)"
}